,Date,Ticker,Claims,IPC,Abstract
0,2022-09-27,ZY,11.0,b01d053/02,"the present disclosure provides novel metal-organic framework materials (mofs) useful, for example, for gas adsorption, storage, and/or separation. also provided are methods of making the mofs, articles of manufacture incorporating the mofs and methods for making these, as well as methods of using the mofs."
1,2022-09-27,ZS,18.0,g06f021/62,"systems and methods include obtaining an expression for a data loss prevention (dlp) engine, wherein the expression includes one or more dlp dictionaries that evaluate to a score for comparison with a corresponding threshold and one or more logical operators used to combine an evaluation of the one or more dlp dictionaries; storing the expression in a database associated with a dlp service; monitoring traffic from one or more users; evaluating the traffic using the dlp engine and the expression; and determining a dlp trigger based on a result of the expression that is a logical true."
2,2022-09-27,ZBRA,19.0,h01m050/20,"a mobile computing device includes: a battery compartment configured to removably secure a first battery pack; an output device; and a processor configured to: detect a second battery pack in proximity to the mobile computing device; responsive to detecting the second battery pack, place the mobile computing device in a low-power operational mode; control the output device to generate a battery swap readiness notification; and responsive to securing of the second battery pack in the battery compartment in place of the first battery pack, return the mobile computing device to a full-power operational mode."
3,2022-09-27,XRX,19.0,c08f002/46,"additive manufacturing processes, such as powder bed fusion of thermoplastic particulates, may be employed to form printed objects in a range of shapes. formation of printed objects having various colors may sometimes be desirable. thermoplastic particulates incorporating a color-changing material capable of forming different colors under specified activation conditions may impart different colors to a printed object. such particulate compositions may comprise a plurality of thermoplastic particulates comprising a thermoplastic polymer and a color-changing material associated with the thermoplastic particulates, wherein the color-changing material is photochromic and thermochromic. conjugated diynes, such as 10,12-pentacosadiynoic acid or a derivative thereof, may be particularly suitable color-changing materials having photochromic and thermochromic properties for forming a range of colors upon a printed object. nanoparticles, particularly silica nanoparticles, associated with an outer surface of the thermoplastic particulates may enhance the brightness of the color obtained under various activation conditions and afford coloration permanence."
4,2022-09-27,XRX,14.0,c08k005/00,"fluorescent magenta latexes are provided which may comprise water and fluorescent agent-incorporated resin particles, the particles comprising a resin, solvent red 49 as a red fluorescent agent, and solvent yellow 98 as a yellow fluorescent agent, wherein the fluorescent magenta latex has a weight ratio of the solvent red 49 to the solvent yellow 98 in a range of from 3:1 to 10:1. fluorescent magenta toners and methods of making and using the fluorescent magenta toners are also provided."
5,2022-09-27,XRX,14.0,c08k005/00,"fluorescent orange latexes are provided which comprise water and fluorescent agent-incorporated resin particles, the particles comprising a resin, solvent red 49 as a red fluorescent agent, and solvent yellow 98 as a yellow fluorescent agent, wherein the fluorescent orange latex has a weight ratio of the solvent yellow 98 to the solvent red 49 in a range of from 20:1 to 0.5:1. fluorescent orange toners and methods of making and using the fluorescent orange toners are also provided."
6,2022-09-27,XRX,19.0,b29c064/188,a system treats uneven surfaces of additive manufactured objects to improve the transparency and glossiness of the surfaces. the system operates an actuator to dip the additive manufactured object into a bath of fluid material that is the same as the material used to form the uneven surface to smooth the surface of the object and operates a sprayer to apply another fluid material to a surface of the object that is identified as being rougher based on the object's geometric data. a heater is provided to dry non-uv curable material applied to the object and a source of uv radiation is provided to cure uv curable material applied to the object.
7,2022-09-27,XAIR,17.0,a61m016/00,"in one embodiment, the present invention provides a system to deliver at least one therapeutic gas to a spontaneously breathing patient, wherein the rate of delivery of the at least one therapeutic gas exceeds the patient's inspiratory flow rate, and the amount of the at least one therapeutic gas that is wasted is minimized or eliminated."
8,2022-09-27,WIRE,20.0,h01b007/00,"a composition and method for reducing the coefficient of friction and required pulling force of a wire or cable are provided. a composition of aqueous emulsion is provided that is environmentally friendly, halogen free and solvent free. the composition is compatible with various types of insulating materials and may be applied after the wire or cable is cooled and also by spraying or submerging the wire or cable in a bath. the composition contains lubricating agents that provide lower coefficient of friction for wire or cable installation and continuous wire or cable surface lubrication thereafter."
9,2022-09-27,WHR,20.0,h02k001/30,"a drive motor for a laundry appliance includes a stator having a plurality of windings that extend around teeth of the stator. a rotor is in electromagnetic communication with the stator. the rotor is coupled to a drive shaft that extends through the stator. when the winding of the stator is electrically energized, the rotor rotates relative to the stator at a predetermined range of rotational frequencies that includes a baseline natural frequency of the rotor. a harmonic-modulating member is attached to the rotor that modulates the baseline natural frequency of the rotor to be a modulated natural frequency. the predetermined range of rotational frequencies is free of the modulated natural frequency of the rotor."
10,2022-09-27,WHR,20.0,f24c015/32,"an air baffle unit includes a major housing wall extending in first and second directions to define an exterior side and an interior side, two upper corner output vent openings, first and second laterally opposed side vent openings, and an air intake opening arrangement defined within an intake area along the major housing wall and extending therealong in the first and second directions. the air intake opening arrangement is defined in an intake area and includes first and second pluralities of intake vents positioned within respective first and second open areas of the intake area with first and second closed areas extending between the first and second open areas. the first and second open areas and first and second closed areas each positioned within respective quarters of the intake area. the open areas are displaced relative to each other in both the first direction and the second direction."
11,2022-09-27,WHR,13.0,f26b019/00,a laundry appliance includes a tub having a rear wall. a drum is rotationally operable within the tub. an air flow path extends through an air flow port defined within the rear wall. a lint filter is positioned within the air flow port. a fluid spray system extends through the rear wall and directs a flow of fluid over the air flow port and the lint filter in a direction generally parallel with an inside surface of the rear wall.
12,2022-09-27,WFRD,13.0,e21b033/12,"a well barrier can include an inner mandrel, a flow passage, and a releasably secured plug. the plug blocks fluid flow through the flow passage, and includes a shoulder that prevents the plug from displacing completely through the inner mandrel. a method of treating a subterranean well can include treating a deeper zone, setting a well barrier in the well between the deeper zone and a shallower zone, then treating the shallower zone, and then applying a pressure differential from the deeper to the shallower zone, thereby displacing a plug out of the well barrier. a well treatment system can include a well barrier with a plug releasably secured to an inner mandrel. the plug is released by application of a pressure differential in a longitudinal direction, and fluid communication is unblocked by application of a pressure differential in an opposite longitudinal direction."
13,2022-09-27,WDC,20.0,g06f003/06,"aspects of a storage device including a memory and a controller are provided which re-prioritize commands based on zone properties. the controller receives from a host commands associated with a plurality of zones, allocates the memory into a plurality of zone resources based on zone properties indicated by the host for the zones, and identifies a utilization state of the memory for one of the zones. the controller changes a priority order of the commands based on the zone properties and the utilization state for the one of the zones. the controller then executes the commands in the memory or zone resources according to the priority order. as a result, execution of commands may be balanced between zones and lower latencies may be achieved overall for each zone. improved performance or throughput of the storage device in handling zone commands may therefore result."
14,2022-09-27,WDC,18.0,h01l021/78,"a substrate-less integrated electronic element module for a semiconductor package, comprising: at least two electronic elements, each of the at least two electronic elements having first electrical connectors; and a first molding compound encapsulating the at least two electronic elements, the first molding compound comprising a first planar surface and an opposing second planar surface of the integrated electronic element module, wherein each of the first electrical connectors is directly exposed on the first planar surface of the integrated electronic element module. further, a semiconductor package including the integrated electronic element module and the method of fabricating the same is provided."
15,2022-09-27,WDC,20.0,h01l023/00,"a method including stacking a number of silicon dice such that one or more edges of the dice are in vertical alignment, where the one or more edges include a number of connection pads. the method also includes positioning a connecting wire on a substantially perpendicular axis to the one or more edges. the connecting wire includes a number of solder blocks formed thereon. the solder blocks are spaced at intervals associated with a distance between a first set of aligned connection pads on the dice. the connecting wire is positioned such that the solder blocks are in contact with the first set of aligned connection pads. the method also includes applying heat to cause the solder blocks to reflow and physically and electrically couple the connecting wire to the connection pads."
16,2022-09-27,WDC,19.0,g11c029/44,"aspects of a storage device including a memory and a controller are provided which allow sub-blocks with different sub-block addresses to be linked across multiple planes to form metablocks. the memory includes multiple blocks in different planes, where each of the blocks includes multiple sub-blocks. the controller links a first sub-block in a first plane and a second sub-block in a second plane with different sub-block addresses to form the metablock. after forming the metablock, the controller programs different word lines in the first and second sub-blocks when writing data to the metablock. thus, the controller may write data to linked or relinked metablocks with different sub-block addresses, thereby improving die yield and memory capacity of the storage device."
17,2022-09-27,WDC,20.0,g11c016/04,the present disclosure generally relates to apparatuses and methods for transmission line termination. in one embodiment an apparatus includes a stack of uniform memory dies and a storage controller. each uniform memory die in the stack of uniform memory dies couples to a transmission line in series through wire bonds to form a transmission path. each memory die includes an on-die termination resistance circuit connected to the transmission line. the on-die termination resistance circuit provides a minimum termination resistance. the storage controller addresses a target uniform memory die of the stack of uniform memory dies for an operation. the storage controller enables the on-die termination resistance circuits of a plurality of uniform memory dies along the transmission path. the storage controller transmits a data signal for the operation to the target uniform memory die with the on-die termination resistance circuit enabled for the plurality of uniform memory dies.
18,2022-09-27,WDC,20.0,g11b033/08,"a data storage system includes a chassis housing multiple data storage devices, such as hard disk drives, a compartment housing cooling fans, and an air plenum positioned between the fans and the storage devices. a multibody chambered acoustic attenuator, which may be installed in the air plenum, includes a plate part having airflow holes therethrough and may include a convex arched part having airflow holes therethrough and coupled with the plate part to form a chamber. acoustic damping material lines an interior surface of the plate part and the interior and exterior surfaces of the arched part, and the airflow holes of the plate part and of the arched part are not aligned, such that direct acoustic emissions and reflections would contact the acoustic damping material and a circuitous airflow path is provided from the cooling fans to the storage devices, to reduce the acoustic sound pressure upon the devices."
19,2022-09-27,WDC,20.0,h03m007/00,"a memory includes, in one embodiment, one or more storage elements; read/write circuitry; and compressed bit circuitry. the read/write circuitry is configured to read a set of hard bits from the one or more storage elements, and sense a set of soft bits while reading the set of hard bits from the one or more storage elements, the set of soft bits having a first fixed size, and the set of soft bits indicating a reliability of the set of hard bits. the compressed soft bit circuitry is configured to generate, with a fixed size soft bit lossy compression algorithm, a fixed size compressed soft bits by compressing the set of soft bits, the fixed size compressed soft bits having a second fixed size that is smaller than the first fixed size, and output the fixed size compressed soft bits to a memory-to-controller bus."
20,2022-09-27,WDC,20.0,h03m013/35,"a memory includes, in one embodiment, nand elements; read/write circuitry; and compressed soft-bit circuitry. the compressed soft-bit circuitry is configured to determine or receive one or more nand conditions and then determine a soft-bit delta and select a compression scheme based on the nand conditions. the read/write circuitry is configured to read a set of hard bits from the nand elements and sense a first set of soft-bits using the determined soft-bit delta while reading the set of hard bits from the nand elements. the first set of soft-bits has a first fixed size, and each soft-bit of the first set of soft-bits indicates a reliability of a corresponding hard bit of the set of hard bits. the compressed soft-bit circuitry is also configured to generate a second set of soft-bits based on the selected compression scheme and output the second set of soft-bits to a controller."
21,2022-09-27,WDC,20.0,g11c029/00,"a memory controller including, in one implementation, a memory interface and a control circuit. the memory interface is configured to receive a punctured codeword read from a non-volatile memory. the control circuit is configured to determine error probability values for a plurality of check nodes associated with a punctured bit included in the punctured codeword. the control circuit is also configured to determine an error probability value for the punctured bit based on the error probability values for the plurality of check nodes associated with the punctured bit and a variable degree associated with the punctured bit. the control circuit is further configured to determine a log likelihood ratio (llr) value for the punctured bit based on the error probability value for the punctured bit. the control circuit is also configured to decode the punctured codeword using the llr value for the punctured bit."
22,2022-09-27,WDC,20.0,h04b010/50,"an electronic device may be provisioned with an infrared (ir) light-emitting diode (led) configured to externally transmit identifying information that particularly identifies the device, such as the device serial number, to outside of the device. a companion portable ir led reader may be used to systematically scan a row or shelf or rack of electronic devices to read the respective communication signals transmitted from each of the respective devices, thereby enabling quick and accurate physical identification of the devices in a system/datacenter and inhibiting the unnecessary removal of an incorrect or misidentified device for replacement."
23,2022-09-27,WDC,18.0,g06f012/02,"aspects of a storage device including a memory and a controller are provided which reduces or eliminates garbage collection in zoned namespace (zns) architectures by mapping zones to sub-blocks of blocks of the memory. each zone includes a plurality of logical addresses. the controller determines a number of open zones, and maps the open zones to the sub-blocks in response to the number of open zones meeting a threshold. thus, larger numbers of open blocks typically present in zns may be reduced, and increased block sizes due to scaling may be accommodated in zns. in some aspects, the controller receives a request from a host device to write data associated with the zones in sub-blocks, and maps each of the zones to at least one of the sub-blocks in response to the request. the request may indicate zones are partially unused. thus, out of zone conditions may also be avoided."
24,2022-09-27,WDC,20.0,g11b005/48,"a multiple-actuator hard disk drive includes multiple head-stack assemblies (hsa) and a disk stack including a shared disk operated upon by both of the hsas. generally to provide more space between the hsas such as for routing electrical traces, the distance between the shared disk and each of the upper and lower adjacent disks is greater than the distance between each of the upper and lower adjacent disks and the next adjacent disk. each arm tip of the arms operating upon the shared disk may be thicker than other arm(s) operating upon other disks in the stack, so that the z-height between each head slider and corresponding disk surface is maintained in view of the differing disk spacing. suspension tails for the arms that operate on the shared disk may be biased to offset away from the shared disk to provide for more clearance between the hsas."
25,2022-09-27,WDC,22.0,g11b005/596,"generating a hard disk drive (hdd) data track repeatable runout (rro) compensation value for a target track involves querying at least one rro table for a closest track to the target track external servo target (est) and identifying an est x  corresponding to the closest track, computing a first absolute value of the difference between the est and the est x , and responsive to the first absolute value being less than an approximation threshold, setting the rro compensation value for the target track to the rro compensation value for the closest track. else, querying the rro table(s) for each adjacent track to the target track, computing the difference between the ests for the adjacent tracks, and responsive to the second absolute value being less than an interpolation threshold, determining an rro compensation value for the target track based on rro compensation values corresponding to the adjacent tracks."
26,2022-09-27,WAB,17.0,g01s019/50,a communication system includes communication units onboard a vehicle system. a first unit receives satellite positioning data and correction data based on phase measurements of satellite signals. a second unit receives the satellite positioning data. one or more processors determine a first geographical position of the first unit based on the position correction data and the satellite positioning data. the processors communicate the position correction data or a copy thereof to the second unit. the processors determine second geographical position data of the second unit based on the position correction data and the satellite positioning data. the one or more processors communicate the second geographical position data that is determined to the first communication unit.
27,2022-09-27,VSAT,16.0,h04b007/204,"methods and systems for calibrating the return and forward links of a satellite communication system are provided according to embodiments of the invention. the phase and/or amplitude variations caused by the return and forward links are calculated and/or estimated to aid in beamforming, such as ground-based beamforming. calibration earth stations, distributed within one or more beam patterns, may be used to transmit calibration codes to the gateway to calibrate the return link. return links variations may be estimated using a weighted minimum mean square algorithm at the gateway. forward links may be calibrated with calibration codes transmitted from the gateway through a hybrid matrix to at least one calibration station. forward calibration links may also calibrate for temperature-dependent signal variations such as diplexer variations at the satellite."
28,2022-09-27,VRTX,8.0,c07d401/04,"compounds of formula (i): 
 
 
 
 
pharmaceutically acceptable salts thereof, deuterated derivatives of any of the foregoing, and metabolites of any of the foregoing are disclosed. pharmaceutical compositions comprising the same, methods of treating cystic fibrosis using the same, and methods for making the same are also disclosed. also disclosed are solid state forms of compound 1 and salts and solvates thereof."
29,2022-09-27,VRAY,20.0,a61b005/055,"a radiation therapy system comprises a magnetic resonance imaging (mri) system combined with an irradiation system, which can include one or more linear accelerators (linacs) that can emit respective radiation beams suitable for radiation therapy. the mri system includes a split magnet system, comprising first and second main magnets separated by gap. a gantry is positioned in the gap between the main mri magnets and supports the linac(s) of the irradiation system. the gantry is rotatable independently of the mri system and can angularly reposition the linac(s). shielding can also be provided in the form of magnetic and/or rf shielding. magnetic shielding can be provided for shielding the linac(s) from the magnetic field generated by the mri magnets. rf shielding can be provided for shielding the mri system from rf radiation from the linac."
30,2022-09-27,VMW,17.0,g06f003/00,"scheduling optimizations for services are described. in one example, a priority category, such as a high, low, or other priority category, can be determined for a service of an application executing on a computing device. if the application is running as a background application on the computing device, an exception to the start of the service can be returned by the operating system of the device, due to background execution limits on the device. in that case, the start of the service can be managed by a service manager of the application based on the priority category for the service. if the priority category for the service is high, the background application can call a foreground service. the call for the foreground service can bring the application to the foreground, and the service manager can again call for the start of the service after the foreground service is running."
31,2022-09-27,VMW,18.0,g06f009/455,systems and methods are described for encrypting a swap file in a computer system. the swap file can be encrypted by a background process executing on the computer system. processing of paging swapping operations occurs independently and separately of the background encryption of the swap file. processing a page swapping operation can include decrypting or encrypting data to be swapped involved in the paging operation depending on the paging operation and whether or not the data to be swapped is encrypted or not.
32,2022-09-27,VMW,20.0,h04l012/18,"some embodiments provide a method of replicating messages for a logical network. at a particular tunnel endpoint in a particular datacenter, the method receives a message to be replicated to members of a replication group. the method replicates the message to a set of tunnel endpoints of the replication group located in a same segment of the particular datacenter as the particular tunnel endpoint. the method replicates the message to a first set of proxy endpoints of the replication group, each of which is located in a different segment of the particular datacenter and for replicating the message to tunnel endpoints located in its respective segment of the particular datacenter. the method replicates the message to a second set of proxy endpoints of the replication group, each of which is located in a different datacenter and for replicating the message to tunnel endpoints located in its respective datacenter."
