,Date,Ticker,Claims,IPC,Abstract
486,2022-09-27,KNBE,20.0,h04l009/40,"systems and methods are described for using a template for simulated phishing campaigns based on predetermined date from a date associated with a user. the predetermined date may by an event, an anniversary or a milestone associated with employment of the user with a company. the campaign controller may identify a date associated with the user and based on the identification of the date associated with the user, the campaign controller may select one or more templates for one or more simulated phishing campaigns to be triggered by a predetermined date related to the date associated with the user."
487,2022-09-27,KNBE,20.0,h04l029/06,"embodiments of the disclosure describe a simulated phishing campaign manager that communicates a simulated phishing communication that includes at least the telephone number and reference identifier, to a device of a user. the content of the simulated phishing communication may prompt the user to call the telephone number identified in the simulated phishing communication. the security awareness system may select a telephone number and a reference identifier to use for the simulated phishing communication, the combination of which may be later used to identify a specific user if they respond to the message. each of a plurality of users may have a unique combination of telephone number and reference identifier. the telephone number may be selected based on the geographic location of the user, or the telephone number may be selected to correspond to content in a simulated phishing communication."
488,2022-09-27,KMT,15.0,b23c005/06,"the invention relates to a cutting insert having a polygonal upper side. cutting edges, which are alternately configured as roughing cutting edges and finishing cutting edges, are provided at the edges of the upper side. the finishing cutting edges define an incircle (k 1 ) having a diameter that is enlarged in comparison to a nominal size of the cutting insert, and the roughing cutting edges define an incircle (k 2 ) having a diameter that is reduced in comparison to the nominal size of the cutting insert. the invention further relates to a cutting tool having a tool body on which at least one such cutting insert is disposed."
489,2022-09-27,KMT,12.0,b23b027/14,"in one aspect, coatings are described herein employing composite architectures providing high aluminum content and high hardness for various cutting applications. for example, a coated cutting tool comprises a substrate and a coating comprising a refractory layer deposited by physical vapor deposition adhered to the substrate, the refractory layer comprising a plurality of sublayer groups, a sublayer group comprising a titanium aluminum nitride sublayer and an adjacent composite sublayer comprising alternating nanolayers of titanium silicon nitride and titanium aluminum nitride."
490,2022-09-27,KLAC,21.0,g03f007/20,"a method and system for measuring misregistration between different layers of a semiconductor device, the method including providing a set of pupil inaccuracy scalable basis elements (pisbes) relating to a plurality of patterned semiconductor device wafers (psdws), generating a single pupil image of a site on a psdw, the psdw being one of the plurality of psdws, by taking a single measurement of the site, the single pupil image including a plurality of site-specific pixels, calculating a set of site-specific pupil inaccuracy scalable basis element scaling factors (pisbesfs) for the single pupil image using the set of pisbes and the plurality of site-specific pixels and calculating a site-specific misregistration value (ssmv) using the set of pisbes and the set of site-specific pisbesfs."
491,2022-09-27,KLAC,37.0,g05b019/4097,"a system includes a controller with processors configured to execute an auto-correlation module embodied in one or more sets of program instructions stored in memory. the auto-correlation module is configured to cause the processors to receive one or more patterned wafer geometry metrics, receive wafer characterization data from one or more characterization tools, determine a correlation between the one or more patterned wafer geometry metrics and the wafer characterization data, generate a ranking of the one or more patterned wafer geometry metrics based on the determined correlation, construct a composite metric model from a subset of the one or more patterned wafer geometry metrics based on the ranking of the one or more patterned wafer geometry metrics, generate one or more composite wafer metrics from the composite metric model, and generate a statistical process control output based on the one or more composite wafer metrics."
492,2022-09-27,KD,20.0,b25j009/16,a method for providing active fall prevention assistance to a user. the method includes one or more computer processors mapping a work area where a user performs a plan of tasks. the method further includes determining a safety configuration related to the user and the task. the method further includes instructing an autonomous device to attach a first tether between a first anchor point and a safety harness secured to the user. the method further includes analyzing real-time images of the work area and the user while the user performs the task. the method further includes determining that the user is at risk of falling. the method further includes responding to determining that the user is at risk of falling by instructing the autonomous device to attach a second tether between a second anchor point and the safety harness secured to the user.
493,2022-09-27,KD,20.0,g06f016/00,"an approach is provided for providing record-level sensitivity-based data storage in a networked computing environment. for each data record of a plurality of data records (e.g., rows) in a dataset, the record sensitivity is identified based on the data included in the data record, allowing different sensitivities to be identified for different records in the same dataset. a data center that has a data center sensitivity level that matches the record sensitivity is selected for the identified record sensitivity. each data record is stored to a selected data center, with data records having different record sensitivities being stored in different data centers of different types, locations, etc."
494,2022-09-27,KD,16.0,h04l067/303,"in an approach, a processor receives from a network device a request. a processor obtains from a database a device profile for the network device. a processor determines whether the device profile of the network device has a data usage pattern related to data identified by a data identifier. in response to determining the device profile has a related data usage pattern, a processor receives the related data usage pattern from the database. in response to determining the device profile does not have a related data usage pattern, a processor obtains a device type profile from the database. a processor classifies the data usage request based on at least one of the device profile and the device type profile. a processor executes a security action based on the classification of the data usage request. a processor stores the data usage request and executed security action to the database."
495,2022-09-27,KD,12.0,g06q050/00,updating a user social network profile of a user based on relevant activities posted by other users in a same social network.
496,2022-09-27,JNPR,20.0,h04l045/586,"a network device is configured to associate a tenant of a plurality of tenants with a virtual routing and forwarding (vrf) instance of a plurality of vrf instances. the network device receives a packet comprising metadata specifying a tenant identifier for the tenant. the network device identifies, based on the tenant identifier specified by the metadata, the vrf instance associated with the tenant. the network device retrieves one or more routes from a routing information base (rib) of the vrf instance associated with the tenant and forwards the packet toward a destination via the one or more routes."
497,2022-09-27,JNPR,20.0,h04l009/40,"a device may receive policy information associated with a first application group and a second application group. the device may receive network topology information associated with a network. the device may generate a first policy based on the policy information and the network topology information, and generate a second policy based on the policy information and the network topology information. the device may provide, to the virtual network device, information associated with the first policy to permit the virtual network device to implement the first policy in association with network traffic transferred between the first application group and the second application group. the device may provide, to the physical network device, information associated with the second policy to permit the physical network device to implement the second policy in association with network traffic transferred between the first application group and the second application group."
498,2022-09-27,JAZZ,15.0,g16h070/40,"a drug distribution system and method utilizes a central pharmacy and database to track all prescriptions for a sensitive drug. information is kept in the database regarding all physicians allowed to prescribe the sensitive drug, and all patients receiving the drug. abuses are identified by monitoring data in the database for prescription patterns by physicians and prescriptions obtained by patients and/or caregivers. further verification is made that the physician is eligible to prescribe the drug by consulting a separate database, and optionally whether any actions are taken against the physician. multiple controls beyond those for normal drugs are imposed on the distribution depending on the sensitivity of the drug."
499,2022-09-27,ITW,20.0,a47c007/28,"a suspended fabric seat includes a frame, a woven fabric suspended in the frame and a plurality of compression limiters attached to the woven fabric. the woven fabric is formed from monofilament fibers that are oriented in a first direction and textile fibers oriented in a second direction transverse to the first direction. the plurality of compression limiters are oriented in the first direction and are formed from a material compatible with the woven fabric. a method for making the suspended fabric seat is also disclosed."
500,2022-09-27,ITW,9.0,b05c005/02,"a slot die assembly for dispensing a fluid onto an article includes an adapter body, a shim package and a die plate. the adapter body includes an adapter conduit configured to receive a fluid. the shim package includes a plurality of shim plates having a shim conduit disposed in fluid communication with the adapter conduit and configured to receive the fluid from the adapter conduit. the shim package further includes a connecting conduit disposed in fluid communication with the shim conduit, a reservoir disposed in fluid communication with the connecting conduit, and a slot disposed in fluid communication with the reservoir. the slot is configured to dispense the fluid onto an article. the die plate is disposed in abutting relationship to the shim package."
501,2022-09-27,ITW,12.0,b66c001/66,"there is disclosed a lifting attachment for a building unit comprising sheeting and a support structure over which the sheeting is disposed, the attachment being configured such that it can be connected to or integrated into the support structure and comprising a lifting anchor that, when the attachment is so connected or integrated, is engageable by a component for lifting the unit such that a releasable interconnection between the component and the support structure passes through an opening in the sheeting."
502,2022-09-27,ITW,5.0,d06f037/42,"a door-lock for a home appliance is provided. the door-lock has a cam that cooperates with a hook and can rotate between two end positions and an intermediate hook holding position. a locking slider cooperates with the cam to lock it and an actuator-controlled locking pin can lock the locking slider. a switch is switchable between open and closed positions, respectively corresponding to the unlocking and locking positions of the locking pin. a cam support carries a trigger element and/or base plate and has a stop that locks the locking slider. a portion of the cam disengages the trigger element from the locking slider when the cam is in an end position opposite a hook release position. the locking slider can rotate beyond the cam locking position to push the locking pin toward the unlocking position with a protrusion when the trigger element is disengaged from the locking slider."
503,2022-09-27,ITW,18.0,f16b005/00,"a connector is provided. the connector includes a post defining a first side, a second side, and a first end. the connector further includes a stationary wing formed on the first side of the post and extending away from the first side of the post. the stationary wing is inflexible relative to the post. the connector further includes a flexible wing attached to the second side of the post adjacent to the first end and extending away from second side of the post. the flexible wing is configured to flex relative to the post."
504,2022-09-27,ITW,20.0,f16b007/18,"a coupler for mounting to externally threaded reinforcing bar for use in concrete construction, the comprising a body having a portion with an internal thread for engagement with the thread of the reinforcing bar, wherein the thread form at the inner end portion of the internal thread includes on one of its flanks an enlargement of progressively increasing extension, the enlargement extending towards an opposing flank of the thread to provide an increasing friction fit with the thread of the bar. various embodiments provide the enlargement being only on a part of the face of the flank whereby the remainder of the face of the flank forms, in conjunction with the adjacent flank of the bar thread during tightening, a void for receiving material displaced during tightening."
505,2022-09-27,ITW,16.0,f16b021/08,"a fastening element ( 1 ) for insertion into an opening ( 50 ) of a part ( 51 ), in particular a vehicle body part, wherein the fastening element ( 1 ) has a head region ( 2 ), a flange region ( 3 ), which is connected to the head region ( 2 ) via a first shaft region ( 4 ), and a second shaft region ( 5 ), which continues from the flange region ( 3 ) on the side opposite the head region ( 2 ) and is formed such that, in the inserted state of the fastening element ( 1 ) in the opening ( 50 ), it extends through the opening ( 50 ), at least in certain regions, and forms a snap connection with the part ( 51 ), in particular vehicle body part, wherein at least one indicator element ( 6 ) is associated with the fastening element ( 1 ) for, in particular, acoustically and/or visually signaling an assembly state of the fastening element ( 1 )."
506,2022-09-27,ITW,11.0,b23b005/16,"a cutting insert configured to couple to a pipe machining apparatus is provided and includes a first cutting edge and a second cutting edge opposite the first cutting edge. a pipe cutting assembly is provided and includes a first base, a second base separate from the first base, and a cutting insert interchangeably couplable to the first base and the second base to perform a first cut with the cutting insert coupled to the first base and a second cut with the cutting insert coupled to the second base. a pipe machining apparatus is provided and includes a tool support, a first cutting tool base and a second cutting tool base interchangeably coupled to the tool support, and a cutting insert interchangeably coupled to the first cutting tool base and the second cutting tool base."
507,2022-09-27,ITRI,20.0,g01r031/36,"disclosed are techniques to conserve battery of an endpoint device. example techniques include adjusting the size of messages transmitted by an endpoint device and/or adjusting the transmission rate of an endpoint device. in some configurations, the one or more criteria are used by an endpoint device to determine what data fields to include within a message and/or adjust a transmission rate associated with the transmission of messages by the endpoint device. for instance, the one or more criteria may include the battery level of the device, the time of year, whether the data has already been transmitted by the endpoint device, whether the data has been acknowledged as received by another device, whether the endpoint device has been instructed by another device to reduce the message size and/or adjust the transmission rate, and the like."
508,2022-09-27,ITCI,28.0,c07d471/16,"the present invention provides improved methods for the preparation of substituted heterocycle fused gamma-carbolines, intermediates useful in producing them and methods for producing such intermediates and such heterocycle fused gamma-carbolines."
509,2022-09-27,IRBT,8.0,a01d034/00,"a method of mowing an area with an autonomous mowing robot comprises storing, in non-transient memory of the robot, a set of geospatially referenced perimeter data corresponding to positions of the mowing robot as the mowing robot is guided about a perimeter of an area to be mowed, removing from the set of perimeter data one or more data points thereby creating a redacted data set and controlling the mowing robot to autonomously mow an area bounded by a boundary corresponding to the redacted data set, including altering direction of the mowing robot at or near a position corresponding to data in the redacted data set so as to redirect the robot back into the bounded area."
510,2022-09-27,IONQ,20.0,g06n010/00,"embodiments described herein are generally related to a method and a system for performing a computation using a hybrid quantum-classical computing system, and, more specifically, to providing an approximate solution to an optimization problem using a hybrid quantum-classical computing system that includes a group of trapped ions. a hybrid quantum-classical computing system that is able to provide a solution to a combinatorial optimization problem may include a classical computer, a system controller, and a quantum processor. the methods and systems described herein include an efficient and noise resilient method for constructing trial states in the quantum processor in solving a problem in a hybrid quantum-classical computing system, which provides improvement over the conventional method for computation in a hybrid quantum-classical computing system."
511,2022-09-27,INTC,19.0,h01p003/08,"an electronic device and associated methods are disclosed. in one example, the electronic device can include an assembly having asymmetrically situated conductors. in selected examples, the assembly includes a ground plane, a central shield portion, a first side shield portion on a first side, a second side shield portion on a second side, a first conductor asymmetrically situated between the central shield portion and the first side shield portion, a second conductor asymmetrically situated between the central shield portion and the second side shield portion, and dielectric within the assembly."
512,2022-09-27,INTC,22.0,h01l023/427,"disclosed herein are thermal assemblies for multi-chip packages (mcps), as well as related methods and devices. for example, in some embodiments, a thermal assembly for an mcp may include a heat pipe having a ring shape."
513,2022-09-27,INTC,28.0,h03h009/10,"packaged rf front end systems including a hybrid filter and an active circuit in a single package are described. in an example, a package includes an active die comprising an acoustic wave resonator. a package substrate is electrically coupled to the active die. a seal frame surrounds the acoustic wave resonator and is attached to the active die and to the package substrate, the seal frame hermetically sealing the acoustic wave resonator in a cavity between the active die and the package substrate."
514,2022-09-27,INTC,20.0,g06f001/30,"techniques and mechanisms for providing redundancy with multiple batteries of a backup power system. in an embodiment, switch circuits are each coupled between a power bus and a different respective one of the multiple batteries. respective nodes of the switch circuits are each to couple to a different respective power sink, wherein power delivery to the power sinks is monitored. based on the monitoring, the switch circuits are configured for a first battery to serve a substitute for a second battery. configuring the switch circuits includes electrically decoupling the second battery from a first node, and electrically coupling the first battery to deliver power via both a power bus and the first node. in another embodiment, multiple backup units each include a respective battery and switch circuit, wherein respective controllers of the backup units intermittently communicate monitoring information via a data bus."
515,2022-09-27,INTC,21.0,h04w008/20,"embodiments are directed to techniques to manage service requests in a wireless network. in one embodiment, an apparatus may comprise processing circuitry. the apparatus may further include computer-readable storage media having stored thereon instructions for execution by the processing circuitry. the instructions, when executed, may determine, at user equipment (ue) operating in an evolved packet system (eps) mobility management (emm)-idle mode and configured to use eps services with control plane cellular internet of things (ciot) eps optimization, to initiate a service request procedure to enable transfer of user data via a control plane, generate a service request message that contains a service type information element (ie) comprising a service type value set to indicate either a mobile originating request or a mobile terminating request, and send the service request message to a mobility management entity (mme) to initiate the service request procedure. other embodiments are described and claimed."
516,2022-09-27,INTC,25.0,h04n013/111,"methods, systems and apparatuses may provide for technology that identifies a seam area between a pair of images corresponding to a first eye and determines a disparity between the seam area and a reference area at a center line of a reference image corresponding to a second eye. the technology may also automatically adjust one or more pre-stitch parameters of camera sensors associated with the pair of images and the reference image based on the disparity."
517,2022-09-27,INTC,25.0,h04l049/901,"logic may store at least a portion of an incoming packet at a memory location in a host device in response to a communication from the host device. logic may compare the incoming packet to a digest in an entry of a primary array. when the incoming packet matches the digest, logic may retrieve a full entry from the secondary array and compare the full entry with the first incoming packet. when the full entry matches the first incoming packet, logic may store at least a portion of the first incoming packet at the memory location. and, in the absence of a match between the first incoming packet and the digest or full entry, logic may compare the first incoming packet to subsequent entries in the primary array to identify a full entry in the secondary array that matches the first incoming packet."
518,2022-09-27,INTC,16.0,g06f015/173,"there is disclosed in one example an application-specific integrated circuit (asic), including: an artificial intelligence (al) circuit; and circuitry to: identify a flow, the flow including traffic diverted from a core cloud service of a network to be serviced by an edge node closer to an edge of the network than to the core of the network; receive telemetry related to the flow, the telemetry including fine-grained and flow-level network monitoring data for the flow; operate the al circuit to predict, from the telemetry, a future service-level demand for the edge node; and cause a service parameter of the edge node to be tuned according to the prediction."
519,2022-09-27,INTC,18.0,h01f027/24,"a recess in a die backside surface occupies a footprint that accommodates an inductor coil that is formed in metallization above an active surface of the die. less semiconductive material is therefore close to the inductor coil. a ferromagnetic material is formed in the recess, or a ferromagnetic material is formed on a dielectric layer above the inductor coil. the recess may extend across a die that allows the die to be deflected at the recess."
520,2022-09-27,INTC,21.0,g06v020/10,"techniques are disclosed to facilitate, in autonomous vehicles, the robust detection and classification of objects in a scene using a static sensors in conjunction with event-based sensors. a trained system architecture may be implemented, and the fusion of both sensors thus allows for the consideration of scenes with overexposure, scenes with underexposure, as well as scenes in which there is no movement. in doing so, the autonomous vehicle may detect and classify objects in conditions in which each sensor, if operating separately, would not otherwise be able to classify (or classify with high uncertainty) due to the sensing environment."
521,2022-09-27,INTC,16.0,g06t015/80,"embodiments are generally directed to methods and apparatuses for encoding based on shading rates. an embodiment of a computing system comprises: a memory; a graphics processing unit (gpu) coupled to the memory, the gpu to render a scene of a graphics application into a color buffer within a frame buffer of the memory; and an encoder coupled to the memory, the encoder to encode the content of the color buffer into a video bitstream based on a plurality of shading rates each corresponding to a pixel in the color buffer."
