,Date,Ticker,Claims,IPC,Abstract
697,2022-09-27,GE,20.0,f01d025/12,"an embodiment of an independent cooling circuit for selectively delivering cooling fluid to a component of a gas turbine system includes: a plurality of independent circuits of cooling channels embedded within an exterior wall of the component, wherein the plurality of circuits of cooling channels are interwoven together; an impingement plate; and a plurality of feed tubes connecting the impingement plate to the exterior wall of the component and fluidly coupling each of the plurality of circuits of cooling channels to at least one supply of cooling fluid, wherein, in each of the plurality of circuits of cooling channels, the cooling fluid flows through the plurality of feed tubes into the circuit of cooling channels only in response to a formation of a breach in the exterior wall of the component that exposes at least one of the cooling channels of the circuit of cooling channels."
698,2022-09-27,GE,17.0,f01d011/20,"methods and apparatus for real-time clearance assessment using a pressure measurement are disclosed. an example method includes determining a first and a second static pressure measurement at a first measurement location and a second measurement location, respectively, relative to the blade tip clearance, determining a normalized pressure measurement using the first and second static pressure measurements, generating a conversion curve to correlate the normalized pressure measurement with a clearance measurement, and adjusting active clearance control of the blade tip clearance based on a comparison of real-time in-flight pressure measurements to the conversion curve."
699,2022-09-27,GE,17.0,a61g011/00,"an infant warming system includes a body temperature probe, a peripheral temperature probe, and at least two identical input jacks, each input jack configured to receive either one of the first connector or the second connector. the body temperature probe has a body temperature sensor removably fixable to an infant's torso to measure a body temperature of the infant, and a first connector configured to connect to an input jack to transmit the body temperature measurement. the peripheral temperature probe includes a peripheral temperature sensor removably fixable to the infant's extremity to measure a peripheral temperature of the infant, and a second connector configured to connect to an input jack to transmit the peripheral temperature measurement. the system further includes a probe detection module to automatically detect whether each input jack is connected to the peripheral temperature probe or the body temperature probe."
700,2022-09-27,GE,23.0,f01d009/04,"fairing assemblies and methods for assembling gas turbine engine fairing assemblies are provided. for example, a fairing assembly comprises a plurality of fairings, an annular inner band defining a plurality of inner pockets, and an annular outer band defining a plurality of outer pockets. each fairing has an inner end radially spaced apart from an outer end. each inner pocket is shaped complementary to each fairing inner end and has forward and aft ends. each outer pocket is shaped complementary to each fairing outer end and has forward and aft ends. the inner and outer bands are each a single piece structure. each fairing inner end is received within one of the plurality of inner pockets, and each fairing outer end is received within one of the plurality of outer pockets. some embodiments also comprise an inner ring positioned against the inner band to close the inner pockets."
701,2022-09-27,GBT,14.0,a61k031/4439,"disclosed are crystalline free base ansolvate forms of 2-hydroxy-6-((2-(1-isopropyl-1h-pyrazol-5-yl)pyridin-3-yl)methoxy)benzaldehyde (or compound 1), such as the free base form i, form ii and material n. also disclosed are crystalline free base solvates of 2-hydroxy-6-((2-(1-isopropyl-1h-pyrazol-5-yl)pyridin-3-yl)methoxy)benzaldehyde (or compound 1)."
702,2022-09-27,FTNT,20.0,h01l025/00,"various heatsink arrangements, and methods for implementing and using such are discussed."
703,2022-09-27,FSS,17.0,b60q001/28,"peripheral lighting system for an emergency vehicle. in an example, the lighting system has a plurality of light heads configured to be located at various positions on the emergency vehicle. a system controller is programmed to individually control each of the light heads via each a plurality of serial communications lines from the controller to the light heads."
704,2022-09-27,FSLY,20.0,h04l009/40,"systems and methods perform selective rate limiting with a distributed set of agents and a remote controller. an agent receives a packet from a client, and inspects the packet using different rules. each rule may include at least one different (i) rule definition with traffic dimensions identifying a different attack, (ii) signal with which to identify attack traffic matching the rule definition, (iii) threshold specifying a condition, and (iv) action to implement based on the condition of the threshold being satisfied. the agent provides the signal in response to the packet matching the traffic dimensions from the rule definition of a particular rule. the controller updates a value linked to the signal and a client identifier of the client, and implements the action of the particular rule across the distributed set of agents in response to the value satisfying the condition for the particular rule threshold."
705,2022-09-27,FSLY,18.0,h04l029/06,"disclosed herein are enhancements for deploying applications in an edge system of a communication network. in one implementation, a cache node in a content delivery network identifies a request for an application that is shared by a plurality of customers. in response to the request, the cache node determines whether the customer associated with the request is permitted to execute the application and, if permitted, initiates the application as an isolation instance. the cache node further, in response to completing the application, returns control to a source operation associated with the request."
706,2022-09-27,FSLY,16.0,g06f021/10,"described herein are methods, systems, and software to handle verification information in a content node. in one example, a method of operating a content node includes receiving a secure content request from an end user device and determining the availability of verification information stored on the content node to service the secure content request. the method further provides, if the verification information is available, verifying the end user device based on the verification information. the method also includes, if the verification information is unavailable, querying an origin server to verify the end user device."
707,2022-09-27,FORM,19.0,g02b021/36,"microscopes with objective assembly crash detection and methods of utilizing the same are disclosed herein. for example, a microscope comprises a microscope body, an objective assembly comprising an objective lens, an objective assembly mount configured to separably attach the objective assembly to the microscope body, and an orientation detection circuit configured to indicate when a relative orientation between the microscope body and the objective assembly differs from a predetermined relative orientation."
708,2022-09-27,FFIV,20.0,g06f015/173,embodiments are directed to stateless communication using a stateful protocol. one or more ntmas may establish a connection with a client computer based on data exchanged with a the client computer using the stateful protocol. the exchanged data may include validation information provided by the one or more ntmas. the exchanged data and other information associated with the connection may be discarded from one or more memories of the one or more ntmas. a network packet communicated over the network using the stateful protocol may be obtained. verification information and candidate validation information may be generated based on one or more characteristics of the network packet. the network packet may be validated based on a comparison of the verification information and the candidate validation information. a reply that adheres to the stateful protocol may be provided to the client computer based on the validated network packet.
709,2022-09-27,FARO,20.0,g01b011/00,"techniques for localizing a portable articulated arm coordinate measuring machine (aacmm) are described. an example localization method includes in response to an aacmm base being placed at a first position, capturing a first set of images of a positioning element in a predetermined area. the method further includes determining first 3d coordinates of the positioning element using the first set of images. 3d coordinates corresponding to a position of a first measurement probe in the predetermined area are computed using the first 3d coordinates. further, the method includes, in response to the base being moved to a second position, determining second 3d coordinates of the positioning element from the second position using a second set of images. further, the localization method includes determining a translation matrix to convert the second 3d coordinates to the first 3d coordinates."
710,2022-09-27,F,16.0,g06q050/30,"apparatus and methods for queueing transportation providers and passengers are described. a method includes queuing in a first queue, first broadcast messages received from passenger mobile devices and queuing in a second queue, second broadcast messages received from transportation provider mobile devices. the method also includes comparing, via a processor, each of the first broadcast messages in the first queue to the second broadcast messages in the second queue to identify a match between one of the first broadcast messages and one of the second broadcast messages."
711,2022-09-27,EW,21.0,a61f002/24,a method and device for anchoring a prosthetic heart valve or annuloplasty ring to a valve annulus in a heart and a method of implanting same is disclosed. the device can include a prosthetic valve or annuloplasty ring with one or more anchors configured to be threaded or otherwise passed underneath a native leaflet and/or subvalvular tissue to secure the device at the native annulus.
712,2022-09-27,EW,18.0,a61b005/1455,"a method and apparatus of non-invasively determining a blood circulatory hemoglobin value for a subject using a near-infrared spectrophotometric (nirs) sensing device is provided. the method includes: a) non-invasively sensing tissue of the subject using the nirs sensing device at about a time t1, and determining at least one nirs tissue totalhb value; b) acquiring at least one circulatory blood sample from the subject at about the time t1; c) determining at least one blood circulatory thb value; d) calibrating the nirs sensing device using the at least one blood circulatory thb value and the at least one nirs tissue totalhb value; and e) determining at least one blood circulatory hemoglobin value using the calibrated nirs sensing device and the at least one nirs tissue totalhb value."
713,2022-09-27,EVGN,12.0,c12n015/82,"provided are methods of increasing nitrogen use efficiency, fertilizer use efficiency, yield, growth rate, vigor, biomass, oil content and/or abiotic stress tolerance of a plant by expressing within the plant an exogenous polynucleotide comprising a nucleic acid sequence encoding a polypeptide at least 80% identical to seq id no: 2560, 2557, 184, 238, 188, 154-156, 158-161, 163-183, 185-187, 189-197, 200-237, 239-264, 266-269, 1351, 1365-1425, 1429-1457, 1459, 1461-1730, 1735, 1739-2397, 2533-2541, 2544-2556, 2558, 2559, 2561-2562 or 2563. also provided are isolated polynucleotides and polypeptides which can be used to increase nitrogen use efficiency, fertilizer use efficiency, yield, growth rate, vigor, biomass, oil content and/or abiotic stress tolerance of a plant of a plant."
714,2022-09-27,EVGN,20.0,c12n015/82,"provided are isolated polypeptides which are at least 80% homologous to seq id nos: 496-794, 2898-3645, and 3647-4855, isolated polynucleotides which are at least 80% identical to seq id nos: 1-495 and 795-2897, nucleic acid constructs comprising same, transgenic cells expressing same, transgenic plants expressing same and method of using same for increasing fertilizer use efficiency, nitrogen use efficiency, yield, growth rate, biomass, vigor, oil content, photosynthetic capacity, seed yield, fiber yield, fiber quality, fiber length, and/or abiotic stress tolerance of a plant."
715,2022-09-27,EMBC,17.0,a61m005/32,"a needle hub assembly for a pen needle includes a needle hub, a cannula or needle coupled to the needle hub, a retractable and compressible sleeve covering at least one end of the cannula, and an outer cover. the outer cover encloses the needle hub and the retractable sleeve. the retractable sleeve is coupled to the hub to cover the end of the cannula where the sleeve can pass through or can be pierced by the cannula and the sleeve retracts axially on the cannula. the sleeve is resilient and returns to an original configuration when an insertion force is released. the needle hub can have a first sleeve to cover a patient end of the cannula, and second sleeve to cover a non-patient end of the cannula where the sleeves retract onto the cannula or hub and expand to the original configuration to cover the ends of the cannula."
716,2022-09-27,EFX,19.0,g06q010/06,"techniques for risk evaluation include receiving, from a requesting entity, a request for monitoring target entities specifying a first identifier associated with each target entity and target entity information. the system generates a second identifier and a third identifier for each target entity and stores a mapping of the second identifiers to the first identifiers and the third identifiers, preventing the second identifiers from being provided to the requesting entity. the system monitors a periodically updated data set and determines risk metrics for the target entities, comparing each risk metric to a threshold value to identify target entities whose risk data indicates an insider threat. the system generates a third identifier for the identified target entities and provides the third identifiers to the requesting entity. responsive to a request for a corresponding first identifier, the system identifies and provides the first and third identifiers to the requesting entity."
717,2022-09-27,EBAY,20.0,g06f016/95,"a system comprising a computer-readable storage medium storing at least one program, and a computer-implemented method for saving and presenting a state of a communication session are presented. the communication session may be established between a client device and an application server of a content publisher, and may include the presentation of content on the client device. in some embodiments, the method may include receiving user input to save a state of the communication session, and in response, temporarily storing session data representative of the state of the communication session for a predetermined duration of the communication session. the method may further include generating and presenting an interface that includes a visual representation of the session data, and allows a user to return to the saved state of the communication session."
718,2022-09-27,EBAY,16.0,g06q030/06,systems and methods are disclosed to receive a message from a user device. the message may include metadata that includes data related to one or more specifications of the user device. the method may also determine a sales price for the user device based on the one or more specifications of the user device and create a listing for the user device that includes at least the sales price and at least one of the one or more specifications of the user device.
719,2022-09-27,EBAY,20.0,g06q030/06,"methods and systems to adapt search results are described. the system receives search information that includes a constraint over a network. the system generates a first search result based on the search information. the system communicates a first user interface, over the network, to the client device. the first user interface is formatted based on first formatting level information. the system receives a first request, over the network, from the client device. the first request includes a description of a first interaction with the first search result. the system identifies a first formatting level based on at least one interaction that was received previous to receiving the first request. the system transitions to a second formatting level based on the first formatting level and the first interaction. the second formatting level is associated with second formatting level information."
720,2022-09-27,EBAY,20.0,h04l067/101,"in a networked data system, a discovery protocol enables clients to establish connections to one a plurality of database servers to utilize a distributed connection service. the service manages connections between application servers, i.e. clients, and databases. an initial request from the client is received by a load balancer. the load balancer responds to the client by identifying an assigned connection to one of the database servers based on load considerations. the client sends a secondary request directly to the assigned connection, bypassing the load balancer. the service establishes a persistent link on the assigned connection and assigns a time-to-live (ttl), during which the service connects data requests to the databases. upon expiration of the ttl, the service completes a next data request received, then notifies the client that the connection is no longer valid, thereby requiring a new connection through the load balancer and rebalancing system traffic."
721,2022-09-27,EBAY,20.0,g06q030/06,"a method and system to process a selection of a browser back button at a client machine. the system receives a browser back button selection, associates the browser back button selection to a first user interface identifier, retrieves the first user interface based on the first user interface identifier, associates the first user interface identifier to a second user interface, and displays the second user interface responsive to selection of the browser back button."
722,2022-09-27,EBAY,20.0,g06q030/06,"methods and systems to browse data items are described. the system receives selections, over the network at a computer based system, from a client machine and uses the selections to identify a level of interest of a first user for a first browsing set. the first browsing set includes a first browsing concept. the system receives a query from, over the network at a computer based system including a keyword. the system automatically selects the first browsing set based on the query and the elevated level of interest of the first user for the first browsing set. the system generates a first user interface including the browsing concept. finally, the system communicates the first user interface including the browsing concept to the client machine."
723,2022-09-27,EBAY,20.0,g06q030/06,"a system receives item data corresponding to an item list from a user. the item list may include one or more items. the system communicates the item list to a community group associated with the user and the system then receives member data from one or more members of the community group, wherein the member data is associated with the one or more items on the item list."
724,2022-09-27,EBAY,20.0,g06n020/00,"a machine learning (ml) pipeline that includes unsupervised learning, supervised learning, and bayesian learning is utilized to train a ml classifier that can classify machine metrics as being indicative of an anomaly. a boosting process can be utilized during the unsupervised learning portion of the ml pipeline that scores clusters of training data for completeness, and further splits clusters of training data based upon the completeness scores in order to optimize the clustering of the training data. supervised learning is then performed on the cluster-labeled training data. bayesian learning can also be utilized to assign incident probability inferences to the clusters of training data. once the ml classifier has been trained, the ml classifier can be utilized in a production environment to classify multi-dimensional machine metrics generated by computing devices in the production environment as being indicative of an anomaly."
725,2022-09-27,DXCM,10.0,a61b005/145,"applicators for applying an on-skin assembly to skin of a host and methods of their use and/or manufacture are provided. an applicator includes an insertion assembly configured to insert at least a portion of the on-skin assembly into the skin of the host, a housing configured to house the insertion assembly, the housing comprising an aperture through which the on-skin assembly can pass, an actuation member configured to, upon activation, cause the insertion assembly to insert at least the portion of the on-skin assembly into the skin of the host, and a sealing element configured to provide a sterile barrier and a vapor barrier between an internal environment of the housing and an external environment of the housing."
726,2022-09-27,DXCM,25.0,g16h040/63,"disclosed are systems and methods for secure and seamless set up and modification of bolus calculator parameters for a bolus calculator tool by a health care provider (hcp). in one aspect, a method for enabling hcp set up of a bolus calculator includes providing a server accessible by both an hcp and a patient; upon login by the hcp, displaying, or transmitting for display, a fillable form, the fillable form including one or more fields for entry of one or more bolus calculator parameters; receiving data from the fillable form, the data corresponding to one or more bolus calculator parameters; and upon login by the patient, transmitting data to a device associated with the patient, the transmitted data based on the received data, where the transmitted data corresponds to one or more of the bolus calculator parameters in a format suitable for entry to a bolus calculator."
727,2022-09-27,DTIL,8.0,c07h021/02,the present invention encompasses genetically-modified immune cells (and populations thereof) expressing a microrna-adapted shrna (shrnamir) that reduces the expression of a target endogenous protein. methods for reducing the expression of an endogenous protein in an immune cell are also provided wherein the method comprises introducing a shrnamir that targets the endogenous protein. using shrnamirs for knocking down the expression of a target protein allows for stable knockdown of expression of endogenous proteins in immune cells.
728,2022-09-27,DSEY,31.0,a47l009/00,"a vacuum cleaner ( 1 ) comprising a container ( 2 ), a suction unit ( 60 ), an air channeling unit ( 25 ), operative between the container ( 2 ) and the suction unit ( 60 ), wherein the air channeling unit ( 25 ) comprises: a collector ( 26 ) having a suction mouth ( 27 ) at an intake side of the air channeling unit ( 25 ), a deflector ( 28 ) positioned at the intake side and radially extending at least over a central portion of the suction mouth ( 27 ), the collector ( 26 ) and the deflector ( 28 ) delimiting a suction channel ( 29 ) connecting the suction mouth ( 27 ) to an inlet port ( 22 ) of the suction unit ( 60 )."
729,2022-09-27,DRQ,20.0,e21b033/04,"systems and methods for landing a tubing hanger in a wellhead, landing a tree on the wellhead, and making electrical and hydraulic couplings between the tree and the tubing hanger without having to orient the tree or the tubing hanger relative to each other are provided. this is accomplished using a seal sub that is coupled to the tree and lowered with the tree into contact with the tubing hanger located in the wellhead. the seal sub features an electrical conductor that facilitates electrical coupling of the tree to the tubing hanger. the tubing hanger and seal sub may include a metal-to-metal and elastomeric seal arrangement designed to seal off electrical and hydraulic connections between these components when, the tree is positioned within the wellhead."
730,2022-09-27,DRQ,9.0,f16l015/08,"an improved anti-rotation device and connector assembly designed to prevent rotation of a first threaded portion of the connector assembly with respect to a second threaded portion of the connector assembly is provided. the anti-rotation device and connector assembly include features that guide and smooth the transition of the anti-rotation device into a position extending through the first and second threaded portions. the anti-rotation device may extend through a tab/groove interface between the first and second threaded portions, or the anti-rotation device may engage opposing interfacing edges of the first and second threaded portions along the length of the anti-rotation device. once the anti-rotation device is installed through the first and second threaded portions, the anti-rotation device may prevent rotation of the threaded portions relative to each other."
731,2022-09-27,DMRC,16.0,g06t001/00,"the present disclosure relates generally improving visibility artifacts associated with encoded signals. a visibility change for local image areas associated with an encoded signal can be determined through use of a plurality of channel-specific contrast sensitivity functions. of course, other features, and related claims and combinations are provided as well."
