,Date,Ticker,Claims,IPC,Abstract
247,2022-09-27,QCOM,48.0,h04l005/00,"methods, systems, and devices for wireless communications are described. a base station may determine that a triggering event associated with a user equipment (ue) has occurred. the ue may receive, based at least in part on an occurrence of a triggering event associated with the ue, a trigger signal that identifies resources to be used for transmission of an aperiodic tracking reference signal (trs). the ue may receive the aperiodic trs based at least in part on the trigger signal and the identified resources. the ue may perform at least one of a tracking function, or a synchronization function, or an alignment function, or a combination thereof, in response to the occurrence of the triggering event and based at least in part on the aperiodic trs."
248,2022-09-27,QCOM,40.0,h04b007/00,"in certain aspects, a method implemented in a wireless device includes determining a specific absorption rate (sar) distribution for a first wireless communication technology, determining a power density (pd) distribution for a second wireless communication technology, and combining the sar distribution and the pd distribution to generate a combined rf exposure distribution. the method also includes determining at least one first maximum allowable power level and at least one second maximum allowable power level for a future time slot based on the combined rf exposure distribution, setting at least one transmission power limit for a first transmitter in the future time slot based on the at least one first maximum allowable power level, and setting at least one transmission power limit for a second transmitter in the future time slot based on the at least one second maximum allowable power level."
249,2022-09-27,QCOM,15.0,h04b007/06,"methods, systems, and devices for wireless communications are described. a wireless device may identify a resource for wireless communication, the resource being in a first state where the resource is active for wireless communication and is inactive for a communication failure recovery procedure. the wireless device may determine that a communication failure has occurred during a first communication period. in some cases, one or more techniques for confirming the communication failure may be used to verify the failure. the wireless device may transition during a second communication period and based at least in part on the communication failure, the resource to a second state where the resource is inactive for wireless communication and is active for the communication failure recovery procedure. the wireless device may perform the communication failure recovery procedure using the resource transitioned to the second state."
250,2022-09-27,QCOM,26.0,h04w028/06,"certain aspects of the present disclosure provide methods and apparatus for managing cyclic redundancy check field lengths in wireless communications. an exemplary method generally includes determining a size of a cyclic redundancy check (crc) field, from a plurality of possible sizes for a given type of physical wireless channel, to be used for a transmission to be sent on the physical wireless channel, and performing communication based on the transmission on the physical wireless channel with the crc field of the determined size."
251,2022-09-27,QCOM,30.0,h04w076/19,"aspects of the present disclosure provide techniques for beam failure detection and related timing determinations, such as for applying a default beam after beam failure recovery response (bfrr) message. a method by a user equipment (ue) may include detecting failure of a beam associated with a first cell. the detecting can include performing beam failure detection (bfd) of a beam pair link (bpl) associated with the first cell (e.g., secondary cell (scell)). the first cell can be in carrier aggregation (ca) with a second cell. the ue may send a beam failure recovery request (bfrq) message on a second cell (e.g., a primary cell (pcell)). the bfrq message can include a candidate recovery beam for the first cell. the ue can receive a bfrr message on the second cell and determine a duration from reception of the bfrr message until using a default beam for communications on the first cell."
252,2022-09-27,QCOM,29.0,h04w004/00,"certain aspects of the present disclosure provide techniques for distance-based harq feedback transmission. a method that may be performed by a user equipment (ue) includes monitoring for a data transmission from another ue, receiving an indication of a first zone identifier (id), determining a nearest zone to the ue of multiple zones, wherein the multiple zones are determined based at least in part on the indication of the first zone id, determining a distance between the ue and the other ue based on the first zone id, wherein the determined distance comprises a distance between the ue and the nearest zone, and transmitting hybrid automatic repeat request (harq) feedback for the data transmission based at least on the distance."
253,2022-09-27,QCOM,30.0,h04w024/10,"design of robust radio link monitoring framework for unlicensed spectrum is disclosed. the network may configured two different types of radio link monitoring (rlm) reference signal (rs) resources: default resources, which are transmitted throughout a connection, and additional resources, which may be transmitted only when there has been failure of transmission or reception of the default resources. various criteria may be used by the network to trigger scheduling transmission of the additional rlm-rs. moreover, different criteria may prompt a user equipment (ue) to begin monitoring the additional rlm-rs resources, including autonomous and network-initiated criteria."
254,2022-09-27,QCOM,26.0,h04w004/00,"various aspects of the present disclosure generally relate to wireless communication. in some aspects, a user equipment (ue) may identify one or more multi-panel capabilities for multi-panel operation of a plurality of panels associated with the ue. the ue may transmit, to a base station (bs), an indication of the one or more multi-panel capabilities. numerous other aspects are provided."
255,2022-09-27,QCOM,31.0,h04w004/40,"methods, systems, and devices for wireless communication are described. a user equipment (ue) that is configured to transmit a message to a neighboring ue via multiple formats, identify a service parameter indicative of a format to be used for the message. the ue may convey information indicating the service parameter from a first layer of the ue to a second layer of the ue, wherein the first layer is an upper layer with respect to the second layer. the ue may generate, by the second layer and based at least in part on the information, the message in the format for communicating with the neighboring ue. other aspects, embodiments, and features are claimed and described."
256,2022-09-27,QCOM,30.0,h04w004/00,"a method, a computer-readable medium, and an apparatus for v2v, v2x, or d2d communication may be a transmitting device configured to determine a source id for communication over a link, to determine a destination id for the communication over the link based on a type of the communication. the transmitting device may be further configured to transmit at least one control message over the link, where the control message(s) indicate the source id and the destination id. in certain aspects, a receiving device may be configured to receive the control message over the link, where the control message indicates the source id and the destination id. the receiving device may be configured to receive a data message over the link and to determine whether to attempt to decode the data message received over the link based on the source id and the destination id indicated in the control message."
257,2022-09-27,QCOM,12.0,h04n019/70,"a method of decoding video data includes decoding, from a coded video bitstream and as an unsigned integer 0-th order exp-golomb-coded syntax element with the left bit first, a value that specifies a target recovery point picture for a current picture of a current sequence of pictures, wherein the target recovery point picture is located at or after the current picture in display order; and recovering decoding of the current sequence of pictures at the target recovery point picture."
258,2022-09-27,QCOM,38.0,h04n019/186,"an example device includes memory configured to store video data and one or more processors implemented in circuitry and coupled to the memory. the one or more processors determine whether a chroma block of the video data is encoded using dual tree partitioning. the one or more processors determine whether transform skip mode for the chroma block is enabled. the one or more processors, based on the chroma block being encoded using dual tree partitioning and transform skip mode being enabled for the chroma block, infer a value of a low-frequency non-separable transform (lfnst) index for the chroma block."
259,2022-09-27,QCOM,38.0,h04n019/176,"a method of encoding video data, the method comprising: generating prediction data of the video data; generating residual data based on the prediction data and digital sample values of the video data; generating coefficients based on the residual data; performing an interlacing process to generate an interlaced amplitude value, wherein the interlacing process interlaces bits of two or more of the coefficients to generate the interlaced amplitude value; modulating an analog signal based on the interlaced amplitude value; generating digital values based on the prediction data; and outputting the analog signal and digital values based on the prediction block."
260,2022-09-27,QCOM,27.0,h04w072/04,"certain aspects of the present disclosure provide techniques for adapting cross-slot scheduling based on carrier groups. for example, certain aspects provide techniques for receiving a time-domain configuration comprising one or more offset values of time-domain resources relative to reception of physical downlink control channel (pdcch), determining which at least one offset value of the one or more offset values are greater than or equal to a minimum offset value of the corresponding carrier, and for each carrier of the group of carriers, one or more of transmitting over a physical uplink shared channel (pusch) or monitoring a physical downlink shared channel (pdsch)."
261,2022-09-27,QCOM,30.0,h04w012/04,"techniques are described for wireless communication. a method of wireless communication at a transmitting wireless device includes generating a first message authentication code for a data packet based at least in part on a first security key used to communicate with a receiving wireless device; generating a second message authentication code for the data packet based at least in part on a second security key used to communicate with a relay user equipment (ue), in which the relay ue is included in a data routing path between the transmitting wireless device and the receiving wireless device; and transmitting the data packet to the relay ue with at least the first message authentication code and the second message authentication code."
262,2022-09-27,QCOM,14.0,h04w076/22,"various aspects of the disclosure relate to event triggers for independent links. for example, an event trigger may be based on measurements from multiple links. in some aspects, the independent links may involve a first device (e.g., a user equipment) communicating via different independent links with different devices (e.g., transmit receive points (trps) or sets of trps). for example, the first device may communicate with a second device (e.g., a trp) via a first link and communicate with a third device (e.g., a trp) via a second link. in some scenarios, an event trigger may be based on aggregated measurements from multiple links."
263,2022-09-27,QCOM,28.0,h04l041/0896,"the present disclosure provides for adaptive resource management in new radio operations that adapts a numerology including a subcarrier spacing and/or cyclic prefix for a user equipment (ue) traveling at a high speed. a base station may transmit via a plurality of remote radio heads (rrh) to a user equipment (ue) is moving along a high speed track. the base station may transmit, in a first time period, using a first numerology including a first subcarrier spacing and a first cyclic prefix ratio, a first transmission for the ue. the base station may transmit, in a subsequent time period, using a second numerology including a second subcarrier spacing and a second cyclic prefix ratio, a second transmission for the ue. at least one of the second subcarrier spacing is different than the first subcarrier spacing or the second cyclic prefix ratio is different than the first cyclic prefix ratio."
264,2022-09-27,QCOM,26.0,h04l027/26,"certain aspects of the present disclosure provide techniques for transmitting and processing reference signals, such as dmrs, that may account for mobility characteristics (e.g., that relate to a doppler measurement) of a wireless node (e.g., a ue), such as doppler measurements indicating how fast such a device is moving."
265,2022-09-27,QCOM,30.0,h04l027/26,"orthogonal frequency-division multiplexing (ofdm) numerologies that maintain symbol boundary alignment while distributing excess cyclic prefixes (cps) among ofdm symbols. communication is established using a first sub-carrier spacing (scs) and a first ofdm numerology, such as an exemplary numerology that distributes excess cp duration among a set of symbols that occupy a time interval within or equal to a corresponding time interval of a symbol of a second ofdm numerology with a second lower scs. the first scs may be, e.g., 960 khz. the second scs may be, e.g., 120 khz. another exemplary ofdm numerology described herein distributes the excess cp as prefix and postfix portions to one of the symbols, such as the first symbol of a set. communication then proceeds using the first ofdm numerology at the first scs and, in illustrative examples, using the second ofdm numerology at the second scs or other ofdm numerologies at other scss."
266,2022-09-27,QCOM,51.0,h04l005/00,"certain aspects of the present disclosure provide techniques for radio resource control (rrc) configuration for sounding reference signal (srs) on additional srs symbols in an uplink subframe. an example method performed by user equipment generally includes receiving, from the network, signaling indicating, for a set of uplink subframes, a first configuration for transmitting one or more srs transmissions of a first type and a second configuration for transmitting one or more srs transmission of a second type; and transmitting, within at least one uplink subframe of the set of uplink subframes, at least one of the one or more srs transmissions of the first type or the one or more srs transmissions of the second type based, at least in part, on at least one of the first configuration or the second configuration."
267,2022-09-27,QCOM,26.0,h04w056/00,"aspects of the present disclosure describe synchronizing frequency and/or timing in a wireless communication system. a synchronization channel frequency can be determined as one of a plurality of possible synchronization channel frequencies within a frequency band. a tone of one or more synchronization signals that corresponds to the synchronization channel frequency can be punctured, and the one or more synchronization signals can be transmitted as centered around the synchronization channel frequency."
268,2022-09-27,QCOM,30.0,h04l005/00,"methods, systems, and devices for wireless communications are described that provide for multiple instances of aperiodic tracking reference signals (trss) that use a same set of large-scale channel properties. if two or more aperiodic trs transmissions are triggered by downlink control information from a base station with a same transmission configuration indicator (tci) state, a ue that receives the two or more aperiodic trs transmissions may measure the multiple instances of the aperiodic trs transmissions assuming that the same large scale parameters or properties can be inferred from each of the aperiodic trs transmissions. the ue may then update one or more time tracking parameters, frequency tracking parameters, or combinations thereof, based on the same large scale transmission parameters being used for the multiple instances of the aperiodic trs transmissions."
269,2022-09-27,QCOM,30.0,h04w056/00,"methods, systems, and devices for wireless communication are described. a base station may transmit a set of synchronization signals (sss) with a first periodicity to a channel engineering device and one or more other wireless devices. the base station may transmit a message to configure the channel engineering device with one or more signaling directions and a second periodicity for the channel engineering device to transmit the set of ss, the second periodicity different from the first periodicity. the one or more signaling directions and the second periodicity may be configured for adjusting a coverage area of the set of ss after transmission from the base station. the base station may receive, from a user equipment (ue) or other wireless device, a second message that includes an indication of whether the set of ss were received by the ue directly from the base station or via the channel engineering device."
270,2022-09-27,PYPL,20.0,g06f009/44,"methods and systems are presented for testing software applications in a production-like environment that simulates real-world failures of production environments. a production environment has production applications and databases configured to process user requests from users for conducting transactions with a service provider. a testing system provides an intermediate interface that enables a software application operating in the test environment to access at least one of a production application or a production database. the intermediate interface can be configured based on different failure configurations to simulate production component failures in the production environment. failure injection and randomized failure modes can be employed, including for network-related failures (latency, dropped packets, connections, etc.) that might occur in the production environment."
271,2022-09-27,PYPL,20.0,g06f016/215,"techniques are disclosed relating to the execution of queries in an online manner. for example, in some embodiments, a server system may include a distributed computing system that, in turn, includes a distributed storage system operable to store transaction data associated with a plurality of users, and a distributed computing engine operable to perform distributed processing jobs based on the transaction data. in various embodiments, the server system preemptively creates a compute session on the distributed computing engine, where the compute session provides access to various functionalities of the distributed computing engine. the distributed computing engine may then use these preemptively created compute sessions to execute queries (e.g., for end users of the server system) against the transaction data and return the results dataset to the requesting users in an online manner."
272,2022-09-27,PYPL,20.0,g06q020/08,a system includes an interface to receive a request associated with a third party at a financial service provider from a network-based device associated with a user. the request includes an identifier that identifies an offer. the system further includes a revenue share application configured to determine whether the transaction involves a plurality of third parties and to determine a payment share for each party of the plurality of third parties based on the transaction involving the plurality of third parties. a payment transfer module transfers the payment share from an account of the user to each account associated with each party of the plurality of third parties.
273,2022-09-27,PYPL,20.0,g06n003/04,"anomalies in a data set may be difficult to detect when individual items are not gross outliers from a population average. disclosed is an anomaly detector that includes neural networks such as an auto-encoder and a discriminator. the auto-encoder and the discriminator may be trained on a training set that does not include anomalies. during training, an auto-encoder generates an internal representation from the training set, and reconstructs the training set from the internal representation. the training continues until data loss in the reconstructed training set is below a configurable threshold. the discriminator may be trained until the internal representation is constrained to a multivariable unit normal. once trained, the auto-encoder and discriminator identify anomalies in the evaluation set. the identified anomalies in an evaluation set may be linked to transaction, security breach or population trends, but broadly, disclosed techniques can be used to identify anomalies in any suitable population."
274,2022-09-27,PYPL,20.0,g06f016/9535,"there are provided systems and methods for an inline editing field for nested website settings. a computing device may be used to process a search query with a search engine and receive results. the search query may include a search for a particular website setting, such as a user profile, account, security, or preference setting that may allow a user to provide input and affect particular user or website data with the website. determination of the requested website may be performed through a machine learning engine. the machine learning engine may identify the security setting nested in the website through multiple navigations, website flows, and navigations, and may extract processes and flows for use of the setting. an inline editing field may then allow for user input in a search interface that allows for editing the setting without navigation to the website and nested setting."
275,2022-09-27,PYPL,20.0,g06f016/93,"techniques are disclosed relating to determining whether document objects included in an image correspond to known document types. in some embodiments, a computing system maintains information specifying a set of known document types. in some embodiments, the computing system receives an image that includes objects. in some embodiments, the computing system analyzes, using a first neural network, the image to identify a document object and location information specifying a location of the document object within the image. in some embodiments, the computing system determines, using a second neural network, whether the document object within the image corresponds to a document type specified in the set of known document types, where the determining is performed based on the location information of the document object. in some embodiments, disclosed techniques may assist in automatically extracting information from documents, which in turn may advantageously decrease processing time for onboarding new customers."
276,2022-09-27,PYPL,20.0,g06q040/04,"systems, methods, and computer program products for providing cloud-based application security are disclosed. for example, a server part of a cloud-based application may determine a plurality of security challenges for authorizing a request based on a plurality of security settings of a user account and one or more attributes of the request, issue a first-level authorization challenge and a second-level authorization challenge based on the determining, identify a plurality of available resources from the user account for the request, and responsive to successful completion of the first-level authorization challenge and the second-level authorization challenge, automatically apply two or more of the available resources from the user account to fulfill the request based on the one or more attributes of the request and a physical location associated with the request."
277,2022-09-27,PYPL,21.0,g06q040/02,"a bank account can be authenticated or confirmed by a user providing an account number and a debit card number. the payment provider then obtains user account information from the bank through a debit card network. the payment provider authenticates the account if the account numbers match. in another embodiment, authentication further requires a portion of a current bank balance in the account provided by the user to match the current balance received from the bank."
278,2022-09-27,PSTG,20.0,g06f015/16,"cloning storage systems in a cloud computing environment, including: receiving a request to create a cloud-based storage system; retrieving, from cloud-based object storage, one or more objects to include in the cloud-based storage system; and creating the cloud-based storage system, including storing, in block storage of the cloud-based storage system, data contained in the one or more objects retrieved from the cloud-based object storage."
279,2022-09-27,PSTG,20.0,g06f009/30,"batch building for artificial intelligence workflows, including: issuing, responsive to a request for a batch of data objects, requests to a data repository for multiple data objects stored among one or more directories; selecting, in accordance with a batch building policy, a subset of data objects based on one or more responses to the requests; and providing, to the artificial intelligence workflow, a batch of data objects that includes the subset of data objects."
